Name,Price,Brand,Review,ID
Điện Thoại Vsmart Active 3 - Hàng Chính Hãng,2750000,Vsmart,(809 nhận xét),5180403403167
Điện Thoại Vsmart Joy 3 - Hàng chính hãng,1900000,Vsmart,(579 nhận xét),2774023213270
Điện Thoại iPhone 11 Pro 256GB - Hàng Nhập Khẩu ,26899000,Apple,(6 nhận xét),5413554992854
Điện Thoại Oppo A12e (3GB/64GB) - Hàng Chính Hãng,2599000,OPPO,(43 nhận xét),9946827055483
Điện thoại Xiaomi Redmi 9A (2GB/32GB) - Hàng chính hãng,1950000,Xiaomi,(30 nhận xét),6693737306374
Điện Thoại Samsung Galaxy M11 (32GB/3GB) - Hàng Chính Hãng,2699000,Samsung,(154 nhận xét),4387243444522
Điện Thoại Vivo Y15 (4GB / 64GB) - Hàng Chính Hãng,2750000,Vivo,(135 nhận xét),4001630745763
"Điện thoại cố định không dây cho người già, màn hình hiển thị đầu số - Hàng chính hãng",430000,Huawei,(2 nhận xét),8721146710364
Điện Thoại Samsung Galaxy A11 (32GB/3GB) - Hàng Chính Hãng,2750000,Samsung,(119 nhận xét),1481122201053
Điện Thoại Samsung Galaxy M21 (64GB/4GB) - Hàng Chính Hãng,3850000,Samsung,(111 nhận xét),8955172053281
ĐIỆN THOẠI XIAOMI REDMI NOTE 9S - HÀNG CHÍNH HÃNG,4590000,Xiaomi,(114 nhận xét),3424737663784
ĐIỆN THOẠI TÂN CỔ ĐIỂN mã  DT14 bàn phím quay dùng sim di động nghe gọi âm thanh rõ ràng (điện thoại bàn tân cổ điển),4900000,OEM,Chưa có nhận xét,8302246545010
Máy Tính Bảng Samsung Galaxy Tab A8 8,2990000,Samsung,(162 nhận xét),4768055136698
Điện Thoại Vivo Y12 (64GB/3GB) - Hàng Chính Hãng,2630000,Vivo,(74 nhận xét),8335999003353
Điện Thoại Samsung Galaxy A51 (128GB/6GB) - Hàng Chính Hãng - Đã Kích Hoạt Bảo Hành Điện Tử,5890000,Samsung,(259 nhận xét),1325135686486
Điện Thoại Bàn Homephone lắp sim - Lắp Tất Cả Các Sim Đi Động - Di Chuyển Mang Đi Khắp Nơi - Hàng Chính Hãng,650000,China Mobile,Chưa có nhận xét,2129306455685
Điện Thoại Nokia 105 Dual Sim (2019) - Hàng Chính Hãng,355000,Nokia,(163 nhận xét),7578609335289
Điện Thoại iPhone 11 64GB  - Hàng  Chính Hãng,18490000,Apple,(183 nhận xét),7227671929864
Điện Thoại Oppo A31 2020 (4GB/128GB) - Hàng Chính Hãng,3650000,OPPO,(56 nhận xét),6081052553939
Điện Thoại Bàn Cố Định Không Dây Lắp Sim,420000,Huawei,(16 nhận xét),5738275429343
Điện thoại Xiaomi Redmi Note 9 (3GB/64GB) - Hàng Chính Hãng,3290000,Xiaomi,(48 nhận xét),4463341821585
Điện Thoại Nokia 105 Single Sim (2019) - Hàng Chính Hãng,350000,Nokia,(159 nhận xét),7139436320222
Điện thoại Xiaomi Redmi Note 9 Pro - Hàng Chính Hãng,5690000,Xiaomi,(58 nhận xét),2711362993685
Điện Thoại Nokia 150 (2020) -  Hàng Chính Hãng,610000,Nokia,(39 nhận xét),3135503316420
iPad 10.2 Inch WiFi 32GB New 2019 - Hàng Nhập Khẩu Chính Hãng,8650000,Apple,(365 nhận xét),2400896275908
Điện Thoại iPhone XS Max 64GB - Hàng Nhập Khẩu,17199000,Apple,(21 nhận xét),6650820721100
Điện Thoại Samsung Galaxy A10s (32GB/2GB) - Hàng Chính Hãng,2650000,Samsung,(79 nhận xét),7516299415539
Điện Thoại Samsung Galaxy A21s - Hàng Chính Hãng,3990000,Samsung,(1 nhận xét),5786661452222
Điện Thoại iPhone 11 Pro Max 64GB  - Hàng  Nhập Khẩu,25499000,Apple,(5 nhận xét),9346809776809
Điện Thoại iPhone 11 128GB  - Hàng Chính Hãng,19990000,Apple,(105 nhận xét),3944486607964
Điện Thoại iPhone 11 Pro Max 64GB - Hàng Chính Hãng ,27490000,Apple,(142 nhận xét),6098931431776
Điện Thoại iPhone 7 Plus 128GB - Hàng Chính Hãng VN/A,9490000,Apple,(138 nhận xét),8162816048644
Điện Thoại Samsung Galaxy Note 20 Ultra (256GB/8GB) - Hàng Chính Hãng,22690000,Samsung,(1 nhận xét),4992710285647
Điện Thoại Samsung Galaxy A51 (128GB/6GB) - Hàng Chính Hãng,6250000,Samsung,(140 nhận xét),6324361101683
Điện Thoại Xiaomi Redmi 9 - Hàng Chính Hãng,3090000,Xiaomi,(25 nhận xét),1091071504787
Điện Thoại Vsmart Live 4 - Hàng Chính Hãng,4490000,Vsmart,(32 nhận xét),9388231832982
Điện Thoại Samsung Galaxy Note 10 Lite (128GB/8GB) - Hàng Chính Hãng - Đã Kích Hoạt Bảo Hành Điện Tử,8790000,Samsung,(47 nhận xét),7611923428579
Điện Thoại Samsung Galaxy A71 (128GB/8GB) - Hàng Chính Hãng,7999000,Samsung,(22 nhận xét),3619375932013
Điện Thoại OPPO A9 2020 (128G/8GB) - Hàng Chính Hãng,4690000,OPPO,(60 nhận xét),5903118724903
Điện Thoại Samsung Galaxy S20 Plus - Hàng Chính Hãng - Đã Kích Hoạt Bảo Hành Điện Tử,17990000,Samsung,(94 nhận xét),2574105597768
Điện Thoại Nokia 5.3 (64GB/3GB) - Hàng Chính Hãng,2799000,Nokia,(59 nhận xét),1311503081953
Điện Thoại  Realme C3i (2GB/32G) - Hàng Chính Hãng,2150000,Realme,(62 nhận xét),4287696261717
"ĐIỆN THOẠI XIAOMI REDMI NOTE 9S (NGUYÊN SEAL, GLOBAL VERSION) - HÀNG NHẬP KHẨU (CÓ SẴN TIẾNG VIỆT KHÔNG CẦN CÀI ĐẶT)",4450000,Xiaomi,(28 nhận xét),6007459192052
Điện Thoại Oppo A5 ( 4GB/128GB) - Hàng Chính Hãng,3790000,OPPO,(28 nhận xét),8934583982304
Điện thoại Vsmart Star 4 (4GB/64GB) - Hàng chính hãng,2290000,Vsmart,(10 nhận xét),2955187124217
Điện Thoại Vsmart Bee 3 - Hàng Chính Hãng,1370000,Vsmart,(61 nhận xét),8944528329934
Điện Thoại Realme C3 - Hàng Chính Hãng,2490000,Realme,(56 nhận xét),8829957720432
iPad Air 10.5 Wi-Fi 64GB New 2019 - Nhập Khẩu Chính Hãng,12990000,Apple,(244 nhận xét),2755467167718
Điện Thoại Di Động GSM ZONO N8110 2.4inch - Hàng Nhập Khẩu,199000,Zono,(154 nhận xét),1283966793820
Điện Thoại iPhone 8 Plus 128GB - Hàng Chính Hãng VN/A,13850000,Apple,(66 nhận xét),7352207416799
Máy Đọc Sách Kindle Paperwhite Gen 10 - 2019 - Hàng Nhập Khẩu,2985000,Kindle,(197 nhận xét),7400219184295
iPad Pro 11 inch (2020) Wifi - Hàng Nhập Khẩu Chính Hãng,21490000,Apple,(18 nhận xét),2919421832603
